Top queries,Clicks,Impressions,CTR,Position
architecture firms in lucknow,2,7,28.57%,12.43
architect company in lucknow,1,2,50%,1
best architects in lucknow,0,11,0%,12.82
best architect in lucknow,0,10,0%,5.6
architecture,0,8,0%,5
top 10 architects in lucknow,0,7,0%,9.86
architect lucknow,0,6,0%,12.33
architect firm in lucknow,0,5,0%,4.4
architect near me,0,3,0%,5.33
architect in lucknow,0,3,0%,7.33
architects near me now,0,3,0%,9.67
top architects in lucknow,0,3,0%,14.33
architectural firms in lucknow,0,2,0%,1
interior designer near me,0,2,0%,1.5
architect fees in lucknow,0,2,0%,8.5
best architect near me,0,2,0%,9
architecture in lucknow,0,2,0%,9.5
architect-led interior finishes for apartments,0,2,0%,12
affordable interior designer lucknow,0,2,0%,14
best architect lucknow,0,2,0%,25.5
architect contact,0,1,0%,1
architects in lucknow,0,1,0%,1
architect engineer,0,1,0%,5
architect engineer near me,0,1,0%,5
2026 bedroom interior design trends india,0,1,0%,8
architect and interior designer in lucknow,0,1,0%,10
architect fees percentage india residential 2025,0,1,0%,10
best architecture in lucknow,0,1,0%,10
3d walkthrough company in lucknow,0,1,0%,12
interior designers in lucknow,0,1,0%,21
best architects near me,0,1,0%,30
best construction company in lucknow,0,1,0%,121