Top queries,Clicks,Impressions,CTR,Position
architects in lucknow,1,2,50%,1
construction rate in lucknow,1,2,50%,36.5
architecture firm in lucknow,1,1,100%,22
best architects in lucknow,0,12,0%,3
architecture firms in lucknow,0,7,0%,11.29
best architect in lucknow,0,5,0%,4
interior design company in lucknow,0,4,0%,11.5
architect engineer near me,0,3,0%,4.67
best architecture in lucknow,0,3,0%,8.67
top 10 architects in lucknow,0,3,0%,9
architecture in lucknow,0,3,0%,9.33
luxury interior designers in lucknow,0,3,0%,32
architectural firms in lucknow,0,2,0%,1
best architecture company in india,0,2,0%,1
best architect companies,0,2,0%,4
architect near me,0,2,0%,5
architect lucknow,0,2,0%,9.5
construction cost per sq ft in lucknow,0,2,0%,26
best interior designer in lucknow,0,2,0%,33.5
architect and interior designer in lucknow,0,1,0%,1
best architect company in india,0,1,0%,1
best architect near me,0,1,0%,1
best classic home design,0,1,0%,1
architecture,0,1,0%,2
top architecture company in india,0,1,0%,5
architect fees percentage for house construction in india,0,1,0%,9
architect,0,1,0%,10
best interior designers in lucknow,0,1,0%,11
architect interior designer in lucknow,0,1,0%,21
top 10 interior designers in lucknow,0,1,0%,21
top architects in lucknow,0,1,0%,26
interior design studio in lucknow,0,1,0%,33
architect office in lucknow,0,1,0%,34
construction cost lucknow,0,1,0%,45
interior designing lucknow,0,1,0%,46
construction cost per square feet in lucknow,0,1,0%,53
best interior design company in lucknow,0,1,0%,54
interior designer in gomti nagar,0,1,0%,66
new projects near me,0,1,0%,74