Top queries,Clicks,Impressions,CTR,Position
architecture firms in lucknow,1,6,16.67%,10.5
architects in india,1,2,50%,1
top architect in lucknow,1,2,50%,13.5
best architect in lucknow,0,20,0%,10.3
best architects in lucknow,0,12,0%,9.42
architecture,0,7,0%,4.14
architect fees percentage india residential 2025,0,5,0%,7.6
architect near me,0,5,0%,13.2
architect in lucknow,0,4,0%,9.25
home design architect,0,3,0%,1
architectural firms in lucknow,0,3,0%,4.33
near by architect office,0,3,0%,6
top 10 architects in lucknow,0,3,0%,7.33
architect lucknow,0,3,0%,11.33
interior designer near me,0,2,0%,1.5
architecture in lucknow,0,2,0%,4
architect engineer near me,0,2,0%,4.5
architect fees in lucknow,0,2,0%,5
near me architect and interior designer,0,2,0%,5
best architecture in lucknow,0,2,0%,9.5
best architect lucknow,0,2,0%,14.5
architects in lucknow,0,1,0%,1
architecture contact number,0,1,0%,1
best architect near me,0,1,0%,1
best architecture company in india,0,1,0%,1
architect office near me,0,1,0%,8
architect fees percentage for house construction in india,0,1,0%,9
architect firm near me,0,1,0%,9
arthitecture,0,1,0%,9
studio architects,0,1,0%,10
experienced architect portfolio,0,1,0%,12
architecture firm in lucknow,0,1,0%,16
fill colour in this picture,0,1,0%,16
#interiordesignlucknow,0,1,0%,19
interior design studio in lucknow,0,1,0%,27
best architects near me,0,1,0%,30
top 10 interior designers in lucknow,0,1,0%,30
architects for house design,0,1,0%,32
architect office in lucknow,0,1,0%,46
best interior designer in lucknow,0,1,0%,63
interior design firms near me,0,1,0%,90